<!ELEMENT rutas (ruta+)>
<!ELEMENT ruta (nombre, tipo, medio, fecha_inicio?, hora_inicio?,
    duracion, agencia, descripcion, personas_adecuadas, inicio, referencias, recomendacion, hitos)>
<!ELEMENT nombre (#PCDATA)>
<!ELEMENT tipo (#PCDATA)>
<!ELEMENT medio (#PCDATA)>
<!ELEMENT fecha_inicio (#PCDATA)>
<!ELEMENT hora_inicio (#PCDATA)>
<!ELEMENT duracion (#PCDATA)>
<!ELEMENT agencia (#PCDATA)>
<!ELEMENT descripcion (#PCDATA)>
<!ELEMENT personas_adecuadas (#PCDATA)>

<!ELEMENT inicio (lugar, direccion, coordenadas)>
<!ELEMENT lugar (#PCDATA)>
<!ELEMENT direccion (#PCDATA)>
<!ELEMENT coordenadas (longitud, latitud, altitud)>

<!ELEMENT longitud (#PCDATA)>
<!ELEMENT latitud (#PCDATA)>
<!ELEMENT altitud (#PCDATA)>

<!ELEMENT referencias (referencia+)>
<!ELEMENT referencia (titulo, bibliografia)>
<!ELEMENT titulo (#PCDATA)>
<!ELEMENT bibliografia (#PCDATA)>


<!ELEMENT recomendacion (#PCDATA)>
<!ELEMENT hitos (hito+)>
<!ELEMENT hito (nombre, descripcion, coordenadas, distancia, galeria_fotos,
    galeria_videos)>
<!ELEMENT distancia (#PCDATA)>

<!ATTLIST distancia unidades CDATA #REQUIRED>

<!ELEMENT galeria_fotos (foto+)>
<!ELEMENT foto (#PCDATA)>
<!ELEMENT galeria_videos (video*)>
<!ELEMENT video (#PCDATA)>
